<?xml version="1.0" encoding="UTF-8"?>
<Correspondences xmlns:xsi="http://www.w3.org/2001/XMLSchema-instance" xsi:noNamespaceSchemaLocation="SchematicCorrespondences.xsd">
  <Correspondence>
    <name>schematicCorrespondence1</name>
    <shortName>sCorr1</shortName>
    <type>SAME_NAME_SAME_CONSTRUCT</type>
    <description>schematicCorrespondence1description</description>
    <direction>BIDIRECTIONAL</direction>
    <Param>
      <name>parameter1name</name>
      <value>parameter1value</value>
      <direction>BIDIRECTIONAL</direction>
    </Param>
    <Constructs1>
    	<Constr>
        	<name>sea</name>
        	<kind>SuperAbstract</kind>
        	<schemaName>Mondial1</schemaName>
      </Constr>
    </Constructs1>
    <Constructs2>
    	<Constr>
        	<name>river</name>
        	<kind>SuperAbstract</kind>
        	<schemaName>Mondial1</schemaName>
      </Constr>
    </Constructs2>
  </Correspondence>
  <Correspondence>
    <name>schematicCorrespondence2</name>
    <shortName>sCorr2</shortName>
    <type>MISSING_SUPER_LEXICAL</type>
    <description>schematicCorrespondence2description</description>
    <direction>FIRST_TO_SECOND</direction>
    <Param>
      <name>parameter2name</name>
      <value>parameter2value</value>
      <direction>FIRST_TO_SECOND</direction>
      	<Constr>
        	<name>country</name>
        	<kind>SuperAbstract</kind>
        	<schemaName>Mondial1</schemaName>
      </Constr>
    </Param>
    <Constructs1>
    	<Constr>
        	<name>country</name>
        	<kind>SuperAbstract</kind>
        	<schemaName>Mondial1</schemaName>
      </Constr>
    </Constructs1>
  	<Constructs2>
  		<Constr>
        	<name>island</name>
        	<kind>SuperAbstract</kind>
        	<schemaName>Mondial1</schemaName>
      </Constr>
  	</Constructs2>     
  </Correspondence>
</Correspondences>
